{
  "published_at": "2026-10-12T12:49:18Z",
  "history_start": "2026-06-16",
  "blend": {
    "in": 0.75,
    "out": 0.25,
    "min_members": 3,
    "method": "chain-linked equal-weight geometric mean: each day's move is the geometric mean of the day-over-day price relatives of the members priced on both days (a member's last price carries at most its staleness limit; a retired model's never past its last observation), = 100 on the chain's first day; a link with fewer than the minimum members priced on both days is flat"
  },
  "models": [
    {
      "key": "claude_opus55",
      "label": "Claude Opus 5.5",
      "tier": "frontier",
      "in_usd_mtok": 4.0,
      "out_usd_mtok": 20.0,
      "blended_usd_mtok": 8.0,
      "as_of": "2026-10-12",
      "chg_30d_pct": null,
      "tail": {
        "dates": [
          "2026-10-09",
          "2026-10-12"
        ],
        "values": [
          8.0,
          8.0
        ]
      }
    },
    {
      "key": "gpt61_sol",
      "label": "GPT-6.1 Sol",
      "tier": "frontier",
      "in_usd_mtok": 2.0,
      "out_usd_mtok": 10.0,
      "blended_usd_mtok": 4.0,
      "as_of": "2026-10-12",
      "chg_30d_pct": null,
      "tail": {
        "dates": [
          "2026-10-09",
          "2026-10-12"
        ],
        "values": [
          4.0,
          4.0
        ]
      }
    },
    {
      "key": "kimi_k3",
      "label": "Kimi K3",
      "tier": "standard",
      "in_usd_mtok": 0.73,
      "out_usd_mtok": 10.0,
      "blended_usd_mtok": 3.0475,
      "as_of": "2026-10-12",
      "chg_30d_pct": null,
      "tail": {
        "dates": [
          "2026-10-09",
          "2026-10-12"
        ],
        "values": [
          3.375,
          3.0475
        ]
      }
    },
    {
      "key": "glm53",
      "label": "GLM-5.3",
      "tier": "standard",
      "in_usd_mtok": 0.089,
      "out_usd_mtok": 4.8,
      "blended_usd_mtok": 1.2668,
      "as_of": "2026-10-12",
      "chg_30d_pct": null,
      "tail": {
        "dates": [
          "2026-10-09",
          "2026-10-12"
        ],
        "values": [
          1.23,
          1.2668
        ]
      }
    },
    {
      "key": "deepseek_v41_flash",
      "label": "DeepSeek V4.1 Flash",
      "tier": "light",
      "in_usd_mtok": 0.15,
      "out_usd_mtok": 0.6,
      "blended_usd_mtok": 0.2625,
      "as_of": "2026-10-12",
      "chg_30d_pct": null,
      "tail": {
        "dates": [
          "2026-10-07",
          "2026-10-08",
          "2026-10-09",
          "2026-10-12"
        ],
        "values": [
          0.525,
          0.2767,
          0.525,
          0.2625
        ]
      }
    },
    {
      "key": "gemini38_flash",
      "label": "Gemini 3.8 Flash",
      "tier": "light",
      "in_usd_mtok": 0.75,
      "out_usd_mtok": 3.75,
      "blended_usd_mtok": 1.5,
      "as_of": "2026-10-12",
      "chg_30d_pct": null,
      "tail": {
        "dates": [
          "2026-10-07",
          "2026-10-08",
          "2026-10-09",
          "2026-10-12"
        ],
        "values": [
          1.5,
          1.5,
          1.5,
          1.5
        ]
      }
    },
    {
      "key": "gpt6_luna",
      "label": "GPT-6 Luna",
      "tier": "light",
      "in_usd_mtok": 0.1,
      "out_usd_mtok": 0.5,
      "blended_usd_mtok": 0.2,
      "as_of": "2026-10-12",
      "chg_30d_pct": null,
      "tail": {
        "dates": [
          "2026-10-09",
          "2026-10-12"
        ],
        "values": [
          0.2,
          0.2
        ]
      }
    }
  ],
  "token_index": {
    "base_date": "2026-07-15",
    "history": {
      "dates": [
        "2026-07-15",
        "2026-07-16",
        "2026-07-17",
        "2026-07-20",
        "2026-07-21",
        "2026-07-22",
        "2026-07-23",
        "2026-07-24",
        "2026-07-25",
        "2026-07-26",
        "2026-07-27",
        "2026-07-28",
        "2026-07-29",
        "2026-07-30",
        "2026-07-31",
        "2026-08-03",
        "2026-08-04",
        "2026-08-05",
        "2026-08-06",
        "2026-08-07",
        "2026-08-10",
        "2026-08-11",
        "2026-08-12",
        "2026-08-13",
        "2026-08-14",
        "2026-08-17",
        "2026-08-18",
        "2026-08-19",
        "2026-08-20",
        "2026-08-21",
        "2026-08-24",
        "2026-08-25",
        "2026-08-26",
        "2026-08-27",
        "2026-08-31",
        "2026-09-01",
        "2026-09-02",
        "2026-09-03",
        "2026-09-04",
        "2026-09-07",
        "2026-09-08",
        "2026-09-09",
        "2026-09-10",
        "2026-09-11",
        "2026-09-14",
        "2026-09-15",
        "2026-09-16",
        "2026-09-17",
        "2026-09-18",
        "2026-09-21",
        "2026-09-22",
        "2026-09-23",
        "2026-09-24",
        "2026-09-25",
        "2026-09-28",
        "2026-09-29",
        "2026-09-30",
        "2026-10-01",
        "2026-10-02",
        "2026-10-05",
        "2026-10-06",
        "2026-10-07",
        "2026-10-08",
        "2026-10-09",
        "2026-10-12"
      ],
      "index": [
        100.0,
        100.0,
        100.0,
        100.0,
        100.0,
        100.0,
        100.0,
        100.0,
        100.0,
        100.0,
        100.0,
        100.0,
        100.0,
        104.278,
        104.278,
        104.278,
        104.278,
        104.278,
        104.278,
        104.278,
        104.278,
        104.278,
        104.278,
        104.278,
        104.278,
        104.278,
        104.278,
        104.278,
        104.278,
        104.278,
        104.278,
        104.278,
        104.278,
        104.278,
        105.947,
        104.278,
        104.278,
        104.746,
        104.746,
        104.746,
        104.746,
        104.746,
        104.278,
        104.278,
        104.278,
        104.278,
        104.278,
        104.278,
        104.746,
        104.746,
        104.746,
        104.746,
        104.746,
        104.746,
        104.278,
        104.278,
        104.278,
        104.278,
        104.278,
        104.278,
        104.278,
        104.278,
        96.255,
        96.255,
        86.28
      ],
      "members": [
        6,
        6,
        6,
        6,
        6,
        6,
        6,
        6,
        6,
        6,
        6,
        6,
        6,
        6,
        6,
        6,
        6,
        6,
        6,
        6,
        6,
        6,
        6,
        6,
        6,
        6,
        6,
        6,
        6,
        6,
        6,
        6,
        6,
        6,
        6,
        6,
        6,
        6,
        6,
        6,
        6,
        6,
        6,
        6,
        6,
        6,
        6,
        6,
        6,
        6,
        6,
        6,
        6,
        6,
        6,
        6,
        6,
        6,
        6,
        6,
        6,
        14,
        8,
        7,
        7
      ]
    },
    "value": 86.28,
    "as_of": "2026-10-12",
    "chg_30d_pct": -17.26
  },
  "token_roster": {
    "since": "2026-10-09",
    "retired": [
      "GPT-5.6 Terra",
      "Claude Sonnet 5.5",
      "Grok 4.7",
      "Qwen3.8 Max",
      "Mistral Large 4",
      "Llama 4 Maverick",
      "GPT-4o",
      "Claude Sonnet 5",
      "Llama 3.1 70B",
      "DeepSeek Chat",
      "Gemini 3.5 Flash",
      "Mistral Large (2024)"
    ]
  },
  "gpus": [
    {
      "code": "vast_h100_sxm",
      "label": "H100 SXM (vast.ai)",
      "usd_per_gpu_hr": 2.2083,
      "as_of": "2026-10-08",
      "chg_30d_pct": 37.83,
      "tail": {
        "dates": [
          "2026-07-15",
          "2026-07-16",
          "2026-07-17",
          "2026-07-20",
          "2026-07-22",
          "2026-07-23",
          "2026-07-24",
          "2026-07-25",
          "2026-07-26",
          "2026-07-27",
          "2026-07-28",
          "2026-07-29",
          "2026-07-30",
          "2026-07-31",
          "2026-08-03",
          "2026-08-04",
          "2026-08-05",
          "2026-08-06",
          "2026-08-07",
          "2026-08-10",
          "2026-08-11",
          "2026-08-12",
          "2026-08-13",
          "2026-08-14",
          "2026-08-18",
          "2026-08-20",
          "2026-08-21",
          "2026-08-24",
          "2026-08-25",
          "2026-08-26",
          "2026-08-27",
          "2026-08-31",
          "2026-09-01",
          "2026-09-02",
          "2026-09-03",
          "2026-09-04",
          "2026-09-07",
          "2026-09-08",
          "2026-09-09",
          "2026-09-11",
          "2026-09-14",
          "2026-09-15",
          "2026-09-16",
          "2026-09-17",
          "2026-09-18",
          "2026-09-21",
          "2026-09-22",
          "2026-09-24",
          "2026-09-25",
          "2026-09-28",
          "2026-09-29",
          "2026-09-30",
          "2026-10-01",
          "2026-10-02",
          "2026-10-06",
          "2026-10-07",
          "2026-10-08"
        ],
        "values": [
          2.0003,
          2.1102,
          2.0046,
          2.0003,
          1.9208,
          1.9208,
          2.8011,
          2.9009,
          2.8508,
          3.3102,
          1.7339,
          3.0007,
          2.5816,
          3.4616,
          2.8011,
          1.6006,
          1.6012,
          1.7339,
          1.7675,
          2.282,
          1.968,
          1.8337,
          2.6036,
          3.2468,
          1.7339,
          1.8687,
          1.4901,
          1.6684,
          1.735,
          1.8678,
          1.7764,
          1.885,
          1.7459,
          1.8011,
          2.0011,
          2.1207,
          1.6022,
          1.6022,
          1.8689,
          1.9489,
          1.7871,
          1.8022,
          3.0018,
          2.0963,
          1.7896,
          1.9356,
          1.7896,
          2.1481,
          1.9744,
          1.8696,
          2.6356,
          3.3349,
          1.7491,
          1.6019,
          1.9218,
          2.1783,
          2.2083
        ]
      },
      "in_index": true,